ID товара	Название товара или услуги	Название товара в URL	URL	Дополнительное описание	Описание	Видимость на витрине	Применять скидки	Тег title	Мета-тег keywords	Мета-тег description	Размещение на сайте	Весовой коэффициент	Валюта склада	НДС	Единица измерения	Габариты	Изображения	Ссылка на видео	ID варианта	Артикул	Штрих-код	Внешний ID	Габариты варианта	Цена продажи	Старая цена	Себестоимость	Остаток	Вес	Изображения варианта	Параметр: Бренд	Параметр: Страна производства	Параметр: Пол	Параметр: Состав	Параметр: Цвет	Параметр: Сезон	Параметр: Рисунок	Параметр: Размер	Параметр: Честный знак	Дополнительное поле: ID Мой Склад
379521759	Носки подростковые белые 30 пар	noski-podrostkovye-belye-120-par	https://купитекстильоптом.рф/collection/hits/product/noski-podrostkovye-belye-120-par	<p>Минимальное количество продажи 36 пар.</p> <p>В упаковке разный размер: 7-9 лет, 9-11 лет, 11-13 лет.</p> <p>Состав: Хлопок 85%, Полиамид 10%, Эластан 5%.</p> <p>Цена за 30 пар 1140 р.</p> <p>Цена за 1 пару 38 р.</p>	""	скрыт	да	""	""	""	Каталог ## Каталог/Хиты продаж ## Каталог/Детям ## Каталог/Детям/Носки для мальчиков ## Каталог/Маркетам/Детям ## Каталог/Маркетам ## Каталог/Оптовикам/Детям ## Каталог/Розничным магазинам/Детям ## Каталог/Оптовикам ## Каталог/Розничным магазинам ## Каталог/Летние модели/Детям ## Каталог/Летние модели		RUR	Без НДС	упак		https://static.insales-cdn.com/images/products/1/3427/713141603/78afcf91-500e-42f8-abbd-d1bb8481d2fd.JPG https://static.insales-cdn.com/images/products/1/2105/781609017/78afcf91-500e-42f8-abbd-d1bb8481d2fd.JPG	""	637268246	CTS 01-2		637268246		1140,0	""	0,0	0	""	""	APOLLON	Китай	Мальчики	Хлопок	Белый	Демисезон				379521759
379524161	Носки детские цвета микс 30 пар сетка	noski-detskie-tsveta-miks-120-par-3	https://купитекстильоптом.рф/collection/hits/product/noski-detskie-tsveta-miks-120-par-3	<p>Минимальное количество продажи 30 пар.</p> <p>В упаковке разный размер: 3-5 лет, 5-7 лет, 7-9 лет.</p> <p>Состав: Хлопок 85%, Полиамид 10%, Эластан 5%.</p> <p>Цена за 30 пар 1140 р.</p> <p>Цена за 1 пару 38 р.</p>	""	скрыт	да	""	""	""	Каталог ## Каталог/Хиты продаж ## Каталог/Детям ## Каталог/Детям/Носки для мальчиков ## Каталог/Розничным магазинам/Детям ## Каталог/Оптовикам/Детям ## Каталог/Оптовикам ## Каталог/Розничным магазинам ## Каталог/Летние модели/Детям ## Каталог/Летние модели		RUR	Без НДС	упак		https://static.insales-cdn.com/images/products/1/4556/713150924/8fb43b4c-996a-4151-812f-3b9b43645fb8.JPG	""	637270868	CTS 03 A		637270868		1140,0	""	0,0	0	""	""	APOLLON	Китай	Девочки##Мальчики	Хлопок	черный, белый, серый	Круглогодичный##Лето##Демисезон	Без рисунка	3-5 лет##5-7 лет##7-9 лет		379524161
379525624	Носки подростковые цвета микс 30 пар сетка	noski-podrostkovye-tsveta-miks-120-par	https://купитекстильоптом.рф/collection/hits/product/noski-podrostkovye-tsveta-miks-120-par	<p>Минимальное количество продажи 30 пар.</p> <p>В упаковке разный размер: 7-9 лет, 9-11 лет, 11-13 лет.</p> <p>Состав: Хлопок 85%, Полиамид 10%, Эластан 5%.</p> <p>Цена за 30 пар 1140 р.</p> <p>Цена за 1 пару 38 р.</p>	""	скрыт	да	""	""	""	Каталог ## Каталог/Хиты продаж ## Каталог/Детям ## Каталог/Детям/Носки для мальчиков ## Каталог/Маркетам ## Каталог/Маркетам/Детям ## Каталог/Розничным магазинам/Детям ## Каталог/Оптовикам/Детям ## Каталог/Оптовикам ## Каталог/Розничным магазинам ## Каталог/Летние модели/Детям ## Каталог/Летние модели		RUR	Без НДС	упак		https://static.insales-cdn.com/images/products/1/4975/713151343/d999e035-e583-4f44-8d9c-b5c183e3b250.JPG https://static.insales-cdn.com/images/products/1/2117/781609029/d999e035-e583-4f44-8d9c-b5c183e3b250.JPG	""	637272386	CTS 03 B		637272386		1140,0	""	0,0	0	""	""	APOLLON	Китай	Мальчики	Хлопок	Разноцветные	Демисезон				379525624
379534009	Хлопковые носки для девочек с бабочками - 30 пар	noski-podrostkovye-dlya-devochek-120-par	https://купитекстильоптом.рф/collection/hits/product/noski-podrostkovye-dlya-devochek-120-par	"<p style=""line-height: 1.38; margin-top: 0pt; margin-bottom: 0pt;""><em><span style=""font-size: 11pt; font-family: Arial, sans-serif; color: rgb(0, 0, 0); background-color: transparent; font-weight: 400; font-variant: normal; text-decoration: none; vertical-align: baseline; white-space: pre-wrap;""><span>Внесите разнообразие в ассортимент магазина детских аксессуаров! </span></span></em></p> <p style=""line-height: 1.38; margin-top: 0pt; margin-bottom: 0pt;""><em><span style=""font-size: 11pt; font-family: Arial, sans-serif; color: rgb(0, 0, 0); background-color: transparent; font-weight: 400; font-variant: normal; text-decoration: none; vertical-align: baseline; white-space: pre-wrap;""><span>Носки для девочек с небольшим принтом в виде бабочек смотрятся очень нежно. Они станут прекрасным дополнением наряда юной модницы. Изделия из натурального хлопка отличаются удобством и не теряют внешний вид после частых стирок. Продаются носки в упаковках по 30 пар разного размера (для 7-9 лет, 9-11 лет и 11-13 лет). В наборе представлены изделия голубого, белого, бежевого, серого и светло-коричневого цветов. </span></span></em></p> <p style=""line-height: 1.38; margin-top: 0pt; margin-bottom: 0pt;""><em><span style=""font-size: 11pt; font-family: Arial, sans-serif; color: rgb(0, 0, 0); background-color: transparent; font-weight: 400; font-variant: normal; text-decoration: none; vertical-align: baseline; white-space: pre-wrap;""><span>Родители девочек будут благодарны вам за качественный товар!</span></span></em></p> <p>&nbsp;</p> <p style=""line-height: 1.38; margin-top: 0pt; margin-bottom: 0pt;""><span style=""font-size: 11pt; font-family: Arial,sans-serif; color: #000000; background-color: transparent; font-weight: bold; font-style: normal; font-variant: normal; text-decoration: none; vertical-align: baseline; white-space: pre-wrap;"">Состав</span><span style=""font-size: 11pt; font-family: Arial,sans-serif; color: #000000; background-color: transparent; font-weight: 400; font-style: normal; font-variant: normal; text-decoration: none; vertical-align: baseline; white-space: pre-wrap;"">: <span>Хлопок 85%, Полиамид 10%, Эластан 5%</span></span></p> <p style=""line-height: 1.38; margin-top: 0pt; margin-bottom: 0pt;""><span style=""font-size: 11pt; font-family: Arial,sans-serif; color: #000000; background-color: transparent; font-weight: bold; font-style: normal; font-variant: normal; text-decoration: none; vertical-align: baseline; white-space: pre-wrap;"">Цена за 30 пар</span><span style=""font-size: 11pt; font-family: Arial,sans-serif; color: #000000; background-color: transparent; font-weight: 400; font-style: normal; font-variant: normal; text-decoration: none; vertical-align: baseline; white-space: pre-wrap;""> <span>1590</span> р.</span></p> <p style=""line-height: 1.38; margin-top: 0pt; margin-bottom: 0pt;""><span style=""font-size: 11pt; font-family: Arial,sans-serif; color: #000000; background-color: transparent; font-weight: bold; font-style: normal; font-variant: normal; text-decoration: none; vertical-align: baseline; white-space: pre-wrap;"">Цена за 1 пару</span><span style=""font-size: 11pt; font-family: Arial,sans-serif; color: #000000; background-color: transparent; font-weight: 400; font-style: normal; font-variant: normal; text-decoration: none; vertical-align: baseline; white-space: pre-wrap;""> 53 р.<br><span style=""font-size: 11pt; font-family: Arial,sans-serif; color: #000000; background-color: transparent; font-weight: bold; font-style: normal; font-variant: normal; text-decoration: none; vertical-align: baseline; white-space: pre-wrap;""><span>В упаковке разный размер</span></span><span style=""font-size: 11pt; font-family: Arial,sans-serif; color: #000000; background-color: transparent; font-weight: 400; font-style: normal; font-variant: normal; text-decoration: none; vertical-align: baseline; white-space: pre-wrap;"">: <span>7-9 лет, 9-11 лет, 11-13 лет.</span></span><br></span></p> <p style=""line-height: 1.656; background-color: #ffffff; margin-top: 0pt; margin-bottom: 0pt;""><span style=""font-size: 11pt; font-family: Arial,sans-serif; color: #000000; background-color: transparent; font-weight: bold; font-style: normal; font-variant: normal; text-decoration: none; vertical-align: baseline; white-space: pre-wrap;"">Минимальная сумма закупки</span><span style=""font-size: 11pt; font-family: Arial,sans-serif; color: #000000; background-color: transparent; font-weight: 400; font-style: normal; font-variant: normal; text-decoration: none; vertical-align: baseline; white-space: pre-wrap;""> - 20 тыс.руб.</span></p> <p style=""line-height: 1.656; background-color: #ffffff; margin-top: 0pt; margin-bottom: 0pt;""><span style=""font-size: 11pt; font-family: Arial,sans-serif; color: #000000; background-color: transparent; font-weight: bold; font-style: normal; font-variant: normal; text-decoration: none; vertical-align: baseline; white-space: pre-wrap;"">Ассортимент </span><span style=""font-size: 11pt; font-family: Arial,sans-serif; color: #000000; background-color: transparent; font-weight: 400; font-style: normal; font-variant: normal; text-decoration: none; vertical-align: baseline; white-space: pre-wrap;"">закупки может быть </span><span style=""font-size: 11pt; font-family: Arial,sans-serif; color: #000000; background-color: transparent; font-weight: bold; font-style: normal; font-variant: normal; text-decoration: none; vertical-align: baseline; white-space: pre-wrap;"">любым </span><span style=""font-size: 11pt; font-family: Arial,sans-serif; color: #000000; background-color: transparent; font-weight: 400; font-style: normal; font-variant: normal; text-decoration: none; vertical-align: baseline; white-space: pre-wrap;"">- можно взять любую упаковку в единственном экземпляре.</span></p> <p style=""line-height: 1.656; background-color: #ffffff; margin-top: 0pt; margin-bottom: 0pt;""><span style=""font-size: 11pt; font-family: Arial,sans-serif; color: #000000; background-color: transparent; font-weight: bold; font-style: normal; font-variant: normal; text-decoration: none; vertical-align: baseline; white-space: pre-wrap;"">Доставка по всей РФ </span><span style=""font-size: 11pt; font-family: Arial,sans-serif; color: #000000; background-color: transparent; font-weight: 400; font-style: normal; font-variant: normal; text-decoration: none; vertical-align: baseline; white-space: pre-wrap;"">(транспортная)</span></p>"	"<p id=""docs-internal-guid-e3d814fc-7fff-43eb-3137-cb0ee0b491a1"" style=""line-height: 1.38; background-color: #ffffff; margin-top: 15pt; margin-bottom: 0pt; padding: 0pt 0pt 15pt 0pt;""><span style=""font-size: 12pt; font-family: Roboto,sans-serif; color: #0d0d0d; background-color: #ffffff; font-weight: 400; font-style: normal; font-variant: normal; text-decoration: none; vertical-align: baseline; white-space: pre-wrap;""><span>Хлопковые носки для девочек с принтом бабочек &ndash; идеальный выбор для стиля и комфорта. Набор из 30 пар включает носки в различных размерах, подходящих для возрастов 7-9 лет, 9-11 лет и 11-13 лет.</span></span></p> <p style=""line-height: 1.38; background-color: #ffffff; margin-top: 0pt; margin-bottom: 15pt;""><strong><span style=""font-size: 12pt; font-family: Roboto, sans-serif; color: rgb(13, 13, 13); background-color: transparent; font-style: normal; font-variant: normal; text-decoration: none; vertical-align: baseline; white-space: pre-wrap;"">Качество:</span></strong></p> <ul> <li style=""line-height: 1.38; background-color: rgb(255, 255, 255);""><span style=""font-size: 12pt; font-family: Roboto,sans-serif; color: #0d0d0d; background-color: #ffffff; font-weight: 400; font-style: normal; font-variant: normal; text-decoration: none; vertical-align: baseline; white-space: pre-wrap;""><span>Состав: 85% хлопок, 10% полиамид, 5% эластан. Высококачественные материалы обеспечивают мягкость, долговечность и комфорт. </span></span></li> <li style=""line-height: 1.38; background-color: rgb(255, 255, 255);""><span style=""font-size: 12pt; font-family: Roboto,sans-serif; color: #0d0d0d; background-color: #ffffff; font-weight: 400; font-style: normal; font-variant: normal; text-decoration: none; vertical-align: baseline; white-space: pre-wrap;""><span>Очаровательный дизайн: Носки с небольшим принтом в виде бабочек и полосками смотрятся очень нежно и добавляют изюминку в повседневный образ. </span></span></li> <li style=""line-height: 1.38; background-color: rgb(255, 255, 255);""><span style=""font-size: 12pt; font-family: Roboto,sans-serif; color: #0d0d0d; background-color: #ffffff; font-weight: 400; font-style: normal; font-variant: normal; text-decoration: none; vertical-align: baseline; white-space: pre-wrap;""><span>Универсальность: Отлично подходят для носки на улице и дома, добавляя комфорт и стиль в любую ситуацию. </span></span></li> <li style=""line-height: 1.38; background-color: rgb(255, 255, 255);""><span style=""font-size: 12pt; font-family: Roboto,sans-serif; color: #0d0d0d; background-color: #ffffff; font-weight: 400; font-style: normal; font-variant: normal; text-decoration: none; vertical-align: baseline; white-space: pre-wrap;""><span>Комфорт и воздухопроницаемость: Мягкий хлопок обеспечивает максимальный комфорт и вентиляцию, поддерживая ноги свежими в течение всего дня.</span></span></li> </ul> <p style=""line-height: 1.38; background-color: #ffffff; margin-top: 15pt; margin-bottom: 15pt;""><strong><span style=""font-size: 12pt; font-family: Roboto, sans-serif; color: rgb(13, 13, 13); background-color: transparent; font-style: normal; font-variant: normal; text-decoration: none; vertical-align: baseline; white-space: pre-wrap;"">Ассортимент цветов:</span></strong></p> <ul> <li style=""line-height: 1.38; background-color: rgb(255, 255, 255);""><span style=""font-size: 12pt; font-family: Roboto,sans-serif; color: #0d0d0d; background-color: transparent; font-weight: 400; font-style: normal; font-variant: normal; text-decoration: none; vertical-align: baseline; white-space: pre-wrap;""><span>Голубой </span></span></li> <li style=""line-height: 1.38; background-color: rgb(255, 255, 255);""><span style=""font-size: 12pt; font-family: Roboto,sans-serif; color: #0d0d0d; background-color: transparent; font-weight: 400; font-style: normal; font-variant: normal; text-decoration: none; vertical-align: baseline; white-space: pre-wrap;""><span>Белый </span></span></li> <li style=""line-height: 1.38; background-color: rgb(255, 255, 255);""><span style=""font-size: 12pt; font-family: Roboto,sans-serif; color: #0d0d0d; background-color: transparent; font-weight: 400; font-style: normal; font-variant: normal; text-decoration: none; vertical-align: baseline; white-space: pre-wrap;""><span>Бежевый </span></span></li> <li style=""line-height: 1.38; background-color: rgb(255, 255, 255);""><span style=""font-size: 12pt; font-family: Roboto,sans-serif; color: #0d0d0d; background-color: transparent; font-weight: 400; font-style: normal; font-variant: normal; text-decoration: none; vertical-align: baseline; white-space: pre-wrap;""><span>Серый </span></span></li> <li style=""line-height: 1.38; background-color: rgb(255, 255, 255);""><span style=""font-size: 12pt; font-family: Roboto,sans-serif; color: #0d0d0d; background-color: transparent; font-weight: 400; font-style: normal; font-variant: normal; text-decoration: none; vertical-align: baseline; white-space: pre-wrap;""><span>Светло-коричневый</span></span><span style=""font-size: 12pt; font-family: Roboto,sans-serif; color: #0d0d0d; background-color: transparent; font-weight: 400; font-style: normal; font-variant: normal; text-decoration: none; vertical-align: baseline; white-space: pre-wrap;""><span></span></span></li> </ul> <p><span style=""font-size: 12pt; font-family: Roboto,sans-serif; color: #0d0d0d; background-color: transparent; font-weight: 400; font-style: normal; font-variant: normal; text-decoration: none; vertical-align: baseline; white-space: pre-wrap;""><span>Эти хлопковые носки с принтом бабочек станут любимым элементом гардероба каждой девочки, добавляя комфорт и стиль в любую ситуацию. </span></span></p> <p><span style=""font-size: 12pt; font-family: Roboto,sans-serif; color: #0d0d0d; background-color: transparent; font-weight: 400; font-style: normal; font-variant: normal; text-decoration: none; vertical-align: baseline; white-space: pre-wrap;""><span>Приобретайте носки оптом и предложите своим клиентам высококачественные и стильные изделия, которые идеально подойдут для повседневного ношения!</span></span></p>"	скрыт	да	""	""	""	Каталог ## Каталог/Хиты продаж ## Каталог/Детям ## Каталог/Детям/Носки для девочек ## Каталог/Маркетам/Детям ## Каталог/Маркетам ## Каталог/Розничным магазинам/Детям ## Каталог/Оптовикам/Детям ## Каталог/Оптовикам ## Каталог/Розничным магазинам ## Каталог/Летние модели/Детям ## Каталог/Летние модели		RUR	Без НДС	упак		https://static.insales-cdn.com/images/products/1/6448/713169200/6649685d-b344-4b19-9f51-9ba94f219bfe.JPG https://static.insales-cdn.com/images/products/1/4437/926011733/CTA12_1.png https://static.insales-cdn.com/images/products/1/4438/926011734/CTA12_2.png https://static.insales-cdn.com/images/products/1/4439/926011735/CTA12_3.png https://static.insales-cdn.com/images/products/1/4440/926011736/CTA12_4.png https://static.insales-cdn.com/images/products/1/4441/926011737/CTA12_5.png https://static.insales-cdn.com/images/products/1/4442/926011738/CTA12_6.png https://static.insales-cdn.com/images/products/1/4443/926011739/CTA12_7.png	""	637281965	CTA12	6970302520121	637281965		1590,0	""	22,0	0	""	""				Хлопок						379534009
